{
  "contract_version": "corridor-lab.scenario/v2",
  "scenario_id": "fictional-tiered-workload",
  "description": "A fictional corridor comparing a declared tiered fee schedule with a flat fee under declared workload volumes.",
  "fictional": true,
  "transaction": {
    "send_amount": "1000.00",
    "send_currency": "AMR",
    "send_precision": 2,
    "receive_currency": "BRC",
    "receive_precision": 2,
    "rounding": "ROUND_HALF_UP",
    "deadline_hours": "12",
    "volume_per_period": "100"
  },
  "workload_scenarios": [
    {"workload_id": "low", "label": "Low declared volume", "transactions_per_period": "50"},
    {"workload_id": "base", "label": "Base declared volume", "transactions_per_period": "100"},
    {"workload_id": "peak", "label": "Peak declared volume", "transactions_per_period": "400"}
  ],
  "objective": {
    "metric": "minimize_expected_sender_cost",
    "guardrails": {"minimum_probability_by_deadline": "0.90"}
  },
  "routes": [
    {
      "contract_version": "corridor-lab.route/v2",
      "route_id": "tiered-marginal",
      "label": "Declared marginal tiered schedule with a volume-amortized platform charge (fictional)",
      "fictional": true,
      "fx_rate": "1.7500",
      "fx_spread_bps": "50",
      "liquidity": {
        "prefunding_amount_send": "36500",
        "annual_cost_of_capital_bps": "1000",
        "holding_days": "1"
      },
      "outcomes": [
        {"outcome_id": "on-time", "probability": "0.95", "completion": "success", "delay_hours": "2", "recovery_amount_send": "0", "recovery_delay_hours": "0"},
        {"outcome_id": "late-success", "probability": "0.03", "completion": "success", "delay_hours": "14", "recovery_amount_send": "0", "recovery_delay_hours": "0"},
        {"outcome_id": "failed-recovered", "probability": "0.02", "completion": "failure", "delay_hours": "3", "recovery_amount_send": "980", "recovery_delay_hours": "24"}
      ],
      "fee_schedule": {
        "basis": "marginal",
        "tiers": [
          {"upper_bound_send": "500", "fixed_fee_send": "5.00", "percent_fee_bps": "40"},
          {"upper_bound_send": "1500", "fixed_fee_send": "3.00", "percent_fee_bps": "25"},
          {"upper_bound_send": null, "fixed_fee_send": "0", "percent_fee_bps": "15"}
        ],
        "period_charges": [
          {"label": "monthly-platform-fee", "amount_send": "400.00", "amortization_over": "scenario_volume"}
        ]
      }
    },
    {
      "contract_version": "corridor-lab.route/v2",
      "route_id": "flat-fee",
      "label": "Declared flat fee with no period charges (fictional)",
      "fictional": true,
      "fx_rate": "1.7500",
      "fx_spread_bps": "50",
      "fixed_fee_send": "6.00",
      "percent_fee_bps": "20",
      "liquidity": {
        "prefunding_amount_send": "20000",
        "annual_cost_of_capital_bps": "1000",
        "holding_days": "0.5"
      },
      "outcomes": [
        {"outcome_id": "on-time", "probability": "0.95", "completion": "success", "delay_hours": "2", "recovery_amount_send": "0", "recovery_delay_hours": "0"},
        {"outcome_id": "late-success", "probability": "0.03", "completion": "success", "delay_hours": "14", "recovery_amount_send": "0", "recovery_delay_hours": "0"},
        {"outcome_id": "failed-recovered", "probability": "0.02", "completion": "failure", "delay_hours": "3", "recovery_amount_send": "980", "recovery_delay_hours": "24"}
      ]
    }
  ]
}
